{
  "$schema": "https://json-schema.org/draft/2020-12/schema",
  "$id": "trace.schema.json",
  "title": "GlassBox execution trace",
  "description": "The single schema for everything the player eats. A traced Python program is 'execution-derived'; a hand-authored process model is 'author-asserted'. validate-traces.mjs additionally cross-checks derivation_source against provenance.trace_source and the per-step provenance.",
  "type": "object",
  "additionalProperties": false,
  "required": ["id", "title", "problem", "register", "language", "derivation_source", "provenance", "source", "trace"],
  "properties": {
    "id": { "type": "string", "pattern": "^[a-z0-9-]+$" },
    "title": { "type": "string", "minLength": 1 },
    "problem": { "type": "string", "minLength": 1 },
    "register": { "enum": ["naive", "procedural", "idiomatic", "clever"] },
    "language": { "enum": ["python", "process"] },
    "derivation_source": { "enum": ["execution-derived", "author-asserted", "hybrid"] },
    "provenance": {
      "type": "object",
      "additionalProperties": false,
      "required": ["language", "trace_source", "tracer_version", "author", "created"],
      "properties": {
        "language": { "enum": ["python", "process"] },
        "trace_source": { "enum": ["sys.settrace", "hand-authored"] },
        "tracer_version": { "type": "string", "minLength": 1 },
        "author": { "type": "string", "minLength": 1 },
        "created": { "type": "string", "pattern": "^\\d{4}-\\d{2}-\\d{2}$" }
      }
    },
    "abstraction": {
      "type": "object",
      "additionalProperties": false,
      "required": ["type"],
      "properties": {
        "type": { "type": "string", "minLength": 1 },
        "label": { "type": "string" },
        "bind": {
          "type": "object",
          "additionalProperties": { "type": "string" }
        }
      }
    },
    "source": { "type": "string", "minLength": 1 },
    "trace": {
      "type": "array",
      "minItems": 1,
      "items": {
        "type": "object",
        "additionalProperties": false,
        "required": ["step", "line", "event", "state", "stdout"],
        "properties": {
          "step": { "type": "integer", "minimum": 0 },
          "line": { "type": "integer", "minimum": 1 },
          "event": { "enum": ["line", "call", "return", "print", "exception"] },
          "state": {
            "type": "object",
            "description": "Full snapshot of in-scope variables. Values are JSON primitives/arrays/objects, or a tagged {__repr__, __unserializable__} placeholder for non-JSON-native values."
          },
          "stdout": { "type": "string" },
          "note": { "type": "string", "description": "Author-asserted meaning for this step (a claim, not an execution fact)." },
          "step_provenance": { "enum": ["execution-derived", "author-asserted"] },
          "value_flags": {
            "type": "object",
            "additionalProperties": { "type": "string" },
            "description": "Maps a variable path to the reason its value was coerced (e.g. repr-coerced, non-finite-float, tuple-as-array)."
          },
          "checkpoint": { "type": "boolean", "description": "Reserved for the future quiz primitive: hide the next state and ask the learner to predict it. No UI in v1." }
        }
      }
    }
  }
}
