{
  "id": "partition-procedural",
  "title": "Sorting into two piles — two separate piles",
  "problem": "Sort the numbers into two piles: evens in one pile, odds in the other.",
  "register": "procedural",
  "language": "python",
  "derivation_source": "execution-derived",
  "provenance": {
    "language": "python",
    "trace_source": "sys.settrace",
    "tracer_version": "0.1.0",
    "author": "GlassBox",
    "created": "2026-06-25"
  },
  "abstraction": {
    "type": "piles",
    "bind": {
      "nums": "source",
      "n": "cursor",
      "evens": "pile_a",
      "odds": "pile_b"
    }
  },
  "source": "nums = [3, 8, 5, 2]\nevens = []\nodds = []\nfor n in nums:\n    if n % 2 == 0:\n        evens.append(n)\n    else:\n        odds.append(n)\n",
  "trace": [
    {
      "step": 0,
      "line": 1,
      "event": "line",
      "state": {
        "nums": [
          3,
          8,
          5,
          2
        ]
      },
      "stdout": "",
      "note": "Our numbers: 3, 8, 5, 2."
    },
    {
      "step": 1,
      "line": 2,
      "event": "line",
      "state": {
        "nums": [
          3,
          8,
          5,
          2
        ],
        "evens": []
      },
      "stdout": ""
    },
    {
      "step": 2,
      "line": 3,
      "event": "line",
      "state": {
        "nums": [
          3,
          8,
          5,
          2
        ],
        "evens": [],
        "odds": []
      },
      "stdout": "",
      "note": "Two genuinely separate empty piles — evens and odds are different lists this time."
    },
    {
      "step": 3,
      "line": 4,
      "event": "line",
      "state": {
        "nums": [
          3,
          8,
          5,
          2
        ],
        "evens": [],
        "odds": [],
        "n": 3
      },
      "stdout": "",
      "note": "Take the first number, n = 3."
    },
    {
      "step": 4,
      "line": 5,
      "event": "line",
      "state": {
        "nums": [
          3,
          8,
          5,
          2
        ],
        "evens": [],
        "odds": [],
        "n": 3
      },
      "stdout": ""
    },
    {
      "step": 5,
      "line": 8,
      "event": "line",
      "state": {
        "nums": [
          3,
          8,
          5,
          2
        ],
        "evens": [],
        "odds": [
          3
        ],
        "n": 3
      },
      "stdout": "",
      "note": "3 is odd, so it goes on the odds pile — and only the odds pile moves."
    },
    {
      "step": 6,
      "line": 4,
      "event": "line",
      "state": {
        "nums": [
          3,
          8,
          5,
          2
        ],
        "evens": [],
        "odds": [
          3
        ],
        "n": 8
      },
      "stdout": ""
    },
    {
      "step": 7,
      "line": 5,
      "event": "line",
      "state": {
        "nums": [
          3,
          8,
          5,
          2
        ],
        "evens": [],
        "odds": [
          3
        ],
        "n": 8
      },
      "stdout": ""
    },
    {
      "step": 8,
      "line": 6,
      "event": "line",
      "state": {
        "nums": [
          3,
          8,
          5,
          2
        ],
        "evens": [
          8
        ],
        "odds": [
          3
        ],
        "n": 8
      },
      "stdout": "",
      "note": "8 is even — onto the evens pile. Each number lands in exactly one pile."
    },
    {
      "step": 9,
      "line": 4,
      "event": "line",
      "state": {
        "nums": [
          3,
          8,
          5,
          2
        ],
        "evens": [
          8
        ],
        "odds": [
          3
        ],
        "n": 5
      },
      "stdout": ""
    },
    {
      "step": 10,
      "line": 5,
      "event": "line",
      "state": {
        "nums": [
          3,
          8,
          5,
          2
        ],
        "evens": [
          8
        ],
        "odds": [
          3
        ],
        "n": 5
      },
      "stdout": ""
    },
    {
      "step": 11,
      "line": 8,
      "event": "line",
      "state": {
        "nums": [
          3,
          8,
          5,
          2
        ],
        "evens": [
          8
        ],
        "odds": [
          3,
          5
        ],
        "n": 5
      },
      "stdout": ""
    },
    {
      "step": 12,
      "line": 4,
      "event": "line",
      "state": {
        "nums": [
          3,
          8,
          5,
          2
        ],
        "evens": [
          8
        ],
        "odds": [
          3,
          5
        ],
        "n": 2
      },
      "stdout": ""
    },
    {
      "step": 13,
      "line": 5,
      "event": "line",
      "state": {
        "nums": [
          3,
          8,
          5,
          2
        ],
        "evens": [
          8
        ],
        "odds": [
          3,
          5
        ],
        "n": 2
      },
      "stdout": ""
    },
    {
      "step": 14,
      "line": 6,
      "event": "line",
      "state": {
        "nums": [
          3,
          8,
          5,
          2
        ],
        "evens": [
          8,
          2
        ],
        "odds": [
          3,
          5
        ],
        "n": 2
      },
      "stdout": ""
    },
    {
      "step": 15,
      "line": 4,
      "event": "line",
      "state": {
        "nums": [
          3,
          8,
          5,
          2
        ],
        "evens": [
          8,
          2
        ],
        "odds": [
          3,
          5
        ],
        "n": 2
      },
      "stdout": "",
      "note": "Every number sorted: evens hold 8 and 2, odds hold 3 and 5. Two clean piles."
    }
  ]
}
